{
  "task_id": "test-task-id",
  "status": "completed",
  "risk_ceiling_used": "L3",
  "public_actions_taken": 0,
  "approval_required": true,
  "artifacts": {
    "report": "/Users/marcotiongson/Documents/gaia-operator-mobile-handoff/.gaia-operator-test/artifacts/test-task-id/report.md",
    "trace": "/Users/marcotiongson/Documents/gaia-operator-mobile-handoff/.gaia-operator-test/artifacts/test-task-id/trace.json",
    "approval_request": "/Users/marcotiongson/Documents/gaia-operator-mobile-handoff/.gaia-operator-test/artifacts/test-task-id/approval-request.md"
  },
  "blocked": false,
  "recommended_next_action": "Review proposed draft replies in: /Users/marcotiongson/Documents/gaia-operator-mobile-handoff/.gaia-operator-test/artifacts/test-task-id/approval-request.md"
}